{
  "name": "@halo/plugin-runtime-node-pnpm",
  "version": "1.0.0",
  "port": "runtime",
  "entry": "../../packages/plugins/dist/runtime-node-pnpm/setup.js",
  "aux": {
    "check": "../../packages/plugins/dist/runtime-node-pnpm/check.js",
    "test": "../../packages/plugins/dist/runtime-node-pnpm/test.js"
  }
}
